Link,Occurred,City,State,Country,Shape,Summary,Reported,Media,Explanation
Open,11/09/2024 11:30,Sandia Park,NM,USA,Oval,"Saw object above a SWA flight. It turned to follow A/C for 3-4 secs, then transited South. Some heading changes. Very fast",11/09/2024,,
Open,11/07/2024 21:17,Hopkins,MN,USA,Formation,U shaped formation of lights moving quickly across the sky shifting inwards and outwards,11/07/2024,,
Open,11/07/2024 21:00,South Bristol,ME,USA,Cube,Bright lites in night sky at approx 25 degrees elevation distance 5-10 miles circular shape,11/08/2024,,
Open !,11/02/2024 20:37,,CA,USA,Triangle,"Triangular formation of lights, Pyramid, sustained interaction.",11/04/2024,Y,
Open,11/02/2024 19:20,Portland,ME,USA,Formation,Saw 3 lights to the SE in a huge triangle formation,11/03/2024,,
Open !,11/01/2024 21:20,Lakeview,OR,USA,Light,Bright white light moving at very high speeds,11/04/2024,Y,
Open,11/01/2024 21:10,Milan,IL,USA,Light,"Watching for landing aircraft, noticed lights on the final approach",11/01/2024,,
Open,10/28/2024 21:16,Tremont,ME,USA,Circle,"Many UAP's flying, stopping in midair, lighting up in a circle, changing altitude - caught on video",10/29/2024,Y,
Open,10/26/2024 19:57,Kimball,SD,USA,Cigar,Saw a cigar shape light flying west to east. Video it. Also checked my flight apps and it was not a plane in the sky.,10/26/2024,Y,Starlink
Open !,10/26/2024 3:15,Minneapolis,MN,USA,Light,White Lights Moving Strangely in the Sky,10/26/2024,Y,
Open,10/25/2024 23:00,Hartshorne,OK,USA,Formation,Two solid small lights a short distance apart moving quickly and low across the sky,11/03/2024,,
Open,10/20/2024 19:30,Allentown,PA,USA,Triangle,2 craft noted. One triangular with white lights. One more circular with orange and white lights,10/21/2024,Y,
Open,10/20/2024 19:16,Titus,AL,USA,Light,Two tiny objects resembling small stars in staggered formation moved silently and rapidly across the sky in a SSW direction.,10/20/2024,,Satellite
Open,10/19/2024 0:03,Morley,MI,USA,Light,"Exactly like Venus in the sky, no trail, didn't fade in or get brighter, stayed a constant brightness, moving too fast for a plane.",10/19/2024,,
Open,10/16/2024 21:55,Santa Rosa,CA,USA,Unknown,Three lights in a row,10/17/2024,Y,
Open !,10/12/2024 21:00,Tillamook,OR,USA,Triangle,"Slow, triangular wing 200 feet overhead",11/07/2024,Y,
Open !,10/10/2024 23:04,Oak Harbor,WA,USA,Orb,I was out looking at the Aurora Borealis and up out of the Dugualla Bay water pops up this Blueish Gray circular Orb.,10/11/2024,Y,
Open,10/07/2024 21:30,Monterey,CA,USA,Chevron,"~7 lights in shape of 120 triangle/chevron, was very high, travelled very fast, silent, lights were similar to satellites",10/09/2024,Y,
Open,10/06/2024 11:40,Arlington,WA,USA,Unknown,"I was walking out the front door, taking my dog out when I saw a very shiny object high in the sky.",10/06/2024,Y,Balloon
Open,09/22/2024 21:01,,AB,Canada,Formation,"Lights out cockpit, 38k ft over rural Alberta. No aircraft reported in the area. Object would be at approx 32k ft",10/07/2024,Y,
Open !,09/22/2024 1:30,La Crosse,WI,USA,Orb,Hovering above the ground and then accelerated away a great speed.,09/26/2024,,
Open !,09/18/2024 13:00,League City,TX,USA,Sphere,I saw a dark basketball sized sphere passing my window while flying a small plane.,09/18/2024,,
Open,09/17/2024 20:10,Pecos,TX,USA,Light,I was traveling NNW and saw a bright light about 15°east of my direction of travel. Saw a bright white/blue light very intense.,09/17/2024,,
Open !,09/17/2024 14:26,Avenal,CA,USA,Cylinder,ATC report of Pilot Sighting,09/17/2024,,
Open !,09/17/2024 14:25,Reef Station,CA,USA,Cylinder,Gray cylinder passing 10ft underneath military aircraft,09/17/2024,,
Open,09/14/2024 19:00,Mesa,AZ,USA,Triangle,A phenomenon that appeared in the stratosphere moved slowly west to east and faded from view as civil twilight ended.,09/14/2024,,
Open,09/13/2024 23:00,Allison,TX,USA,Orb,These were lights fading in and out following irregular patterns identical to Marfa lights,09/14/2024,,
Open,09/12/2024 6:40,Fishers,IN,USA,Light,Light with cone shaped cloud,09/12/2024,Y,Rocket
Open,09/12/2024 5:39,Chisago City,MN,USA,Light,Bright object drifting northeast from our home,09/12/2024,Y,
Open !,09/08/2024 21:23,Oostende,West Flanders,Belgium,Orb,Approx. 5-foot wide orb that was the mixed color of fire encapsulated in glass hovered above rural tree line before disappearing,09/23/2024,,
Open,08/30/2024 2:44,,CO,USA,Light,Pilots observed bright lights moving in an unusual manner in the sky above Colorado,08/29/2024,,
Open !,08/28/2024 23:00,,,International Waters,Light,Up to six satellite appearing lights under and to west of Big Dipper tail,08/31/2024,Y,
Open,08/26/2024 14:17,Hood River,OR,USA,Unknown,Was taking zoomed in pictures of a 4 engine jet for a wallpaper on my phone.,08/31/2024,Y,Bird?
Open !,08/23/2024 12:07,Boston,MA,USA,Star,Viewed from the flight deck by both pilots and a cabin crew,08/24/2024,,
Open,08/17/2024 23:20,Florissant,CO,USA,Unknown,"Eratic Moving ""Stars""",08/19/2024,,
Open !,08/15/2024 23:58,Sterling,Illinois,United States,Orb,My Co-pilot a former Airforce pilot pointed out 3 objects to my attention.,08/17/2024,,
Open,08/13/2024 22:40,Wuppertal,North Rhine-Westphalia,Germany,Fireball,Initially we thought this was a meteor but it moved slowly across the sky.,08/18/2024,Y,Contrail
Open,08/13/2024 16:45,Reston,VA,USA,Orb,"2 orbs in parallel with one in trail, then formed a perfect triangle, two vanished, 10 seconds later the third disappeared as well",08/13/2024,,
Open,08/12/2024 23:30,Westminster,MD,USA,Cylinder,see attahced papaers,08/13/2024,Y,
Open,08/12/2024 19:09,Chicago,IL,USA,Orb,"6 bright lights over downtown Chicago, and a 7th flew by as well",08/12/2024,Y,Balloons?
Open !,08/01/2024 3:40,Fort Edward,NY,USA,Cigar,Bright green cigar shaped craft flies past our plane,08/08/2024,,
Open,07/13/2024 22:45,Seffner,FL,USA,Star,Unknown lights north of Tampa,07/17/2024,Y,
Open !,07/12/2024 11:00,Eagle Grove,IA,USA,Rectangle,20 foot drone-like box.,07/14/2024,Y,
Open,07/08/2024 21:00,Morley,England,United Kingdom,Star,"Object hovered over house, looked like a star, police dismissed as possible drone due to height. Couldn't find telescope, object disapp",07/08/2024,,Drone?
Open,07/05/2024 17:00,Middletown Township,NJ,USA,Changing,"A Blackhawk helicopter passed over at less than 1000ft, during which I noticed me a bright white object several thousand above.",07/06/2024,,
Open,06/28/2024 1:30,Plattsmouth,Nebraska,United States,Formation,"Lights in the west 45° above the horizon approximately 4 miles in the distance, objects moved slowly at first an left",07/16/2024,Y,
Open,06/21/2024 21:30,Whitewater,CA,USA,Cylinder,The object was photographed while photographing the full moon,06/22/2024,Y,
Open !,06/16/2024 14:59,Anchor Point,AK,USA,Cigar,Large object hovering over summit of Redoubt volcano,06/19/2024,Y,
Open !,06/11/2024 0:31,,,Unspecified,Orb,"Lights in low earth orbit illuminating brightly then fading, staying stationary, then moving in multiple directions, then orbiting",06/28/2024,,
Open,06/10/2024 6:00,Agua de Castilla,Departamento de Potosí,Bolivia,Circle,"A flying object with flashes of various colors was spotted at about 10,000 feet and was descending",06/10/2024,Y,
Open,06/08/2024 16:30,Summerville,SC,USA,Oval,I saw one irregular black object. My picture shows up to 11 maybe more,06/08/2024,,
Open,05/31/2024 21:06,Hemet,CA,USA,Light,Bright White Light with Foggy Glow but clear skys,05/31/2024,,Rocket
Open,05/25/2024 20:55,Tacoma,WA,USA,Formation,Formation of craft/objects,07/09/2024,Y,Balloon
Open,05/22/2024 21:05,,,Unspecified,Orb,Hourglass haze flying over South Las Vegas,05/22/2024,Y,Rocket
Open,05/22/2024 20:39,Spokane,WA,USA,Circle,Analysis of Large circular object hovering 4 min.'s,05/24/2024,Y,
Open,05/22/2024 19:39,Spokane,WA,USA,Circle,Extremely bright white orb or circle over,05/23/2024,Y,
Open,05/17/2024 18:12,Denver,CO,USA,Changing,Metallic sparkling shape shifting object spotted overhead moving at speed of jet from west to east a straight line viewed with binocs,05/17/2024,,Balloon?
Open,05/16/2024 0:40,Cumming,GA,USA,Triangle,"Saw a triangle of three faint red lights, it did not move in a straight line",05/15/2024,,
Open,05/11/2024 21:46,Parlier,CA,USA,Diamond,The strange orb was blue and weird it lasted for about 2 minutes,05/11/2024,,
Open,05/11/2024 7:13,Redmond,OR,USA,Other,"Jellyfish style UAP traveling from the west, to the east",05/11/2024,Y,
Open,05/07/2024 15:00,Anderson,SC,USA,Flash,I saw a bright flash and then the light moved from right to left and zoomed off quickly,08/01/2024,,
Open,05/02/2024 20:06,Buckeye,AZ,USA,Light,"Flying westbound at 43000’ object was opposite direction, appeared to be orbital alt and speed, large aura around object.",05/03/2024,Y,Rocket
Open,05/01/2024 22:30,,Delhi,India,Star,Saw 20-30 stars emerge in from the Auriga constellation and travel and turned conspicuously east of Star Capella,05/01/2024,,
Open,04/29/2024 18:15,Clinton,MO,USA,Changing,Weather balloon? Altitude was about 5000 feet guestamation. Unable to get ahold of WAFB for info,05/02/2024,Y,Balloon
Open,04/27/2024 20:45,Avon,NC,USA,Cone,The object was brightly lit with a large spread out vapor/smoke trail,04/27/2024,Y,Rocket
Open !,04/24/2024 3:00,,,International Waters,Light,Multiple objects above our altitude.,04/24/2024,Y,
Open,04/12/2024 20:31,Tulsa,OK,USA,Changing,Bright flash in the sky. Then light dimmed to no light. UFO had additional lights. Another bright flash and it was gone,04/12/2024,,
Open !,04/12/2024 20:10,Yucca,AZ,USA,Oval,"I witnessed and filmed an oblong object moving in the sky with no noise, a large directional light and window.",04/15/2024,Y,
Open,04/02/2024 12:30,Goodyear,AZ,USA,Sphere,Two silent objects slowly drifting and changing direction of travel.,04/03/2024,Y,
Open,03/28/2024 19:59,Bulverde,TX,USA,Rectangle,"While reviewing pictures of a full rainbow, the camera detected an anomaly that was not visible with the naked eye",03/31/2024,Y,
Open,03/18/2024 22:53,Oak Harbor,WA,USA,Orb,"ORB became visible 145 degrees 20 miles from my home deck at an estimated altitude of 10,000 FEET",03/27/2024,,
Open,03/15/2024 21:11,Cincinnati,OH,USA,Orb,I was walking from parking a truck I looked up admiring the night sky when something caught my eye 2 orb like objects.,03/15/2024,,
Open,03/04/2024 19:30,Canby,MN,USA,Cube,Strange object observed while inflight,03/04/2024,Y,Rocket
Open,03/04/2024 17:30,Pueblo West,CO,USA,Orb,"White orb descended to 1000 AGL, exploded with a white halo, smoke and changed direction.",03/05/2024,,Rocket
Open,03/03/2024 22:00,Maud,TX,USA,Flash,A friend showed this video to me saying it was on a night flight and is certain it wasn’t from the plane cabin nor his I phone focusing,08/05/2024,Y,
Open,03/03/2024 22:00,Genoa,AR,USA,Diamond,The blue diamond shaped object can be seen during the last 1/3 of the video in the very far upper right rotating end over end .,08/05/2024,Y,
Open !,03/02/2024 22:23,Beckley,WV,USA,Orb,My captain and I saw moving stars. Looked kinda like satellites.,03/03/2024,Y,
Open !,02/28/2024 21:00,Mogi das Cruzes,São Paulo,Brazil,Orb,At least 40 orbs of light rising from the horizon in the distance,02/29/2024,,
Open !,02/27/2024 21:00,,-,USA,Orb,Multiple orbs of light over the Pacific Ocean maneuvering in a purposeful way for over two hours,02/28/2024,,
Open,02/26/2024 3:00,Draper,UT,USA,Other,"Outside at about 3 or 4 AM, notice flying object in sky. Barely visible, only illuminated by the moonlight.",03/16/2024,Y,
Open !,02/25/2024 21:12,Washington,DC,USA,Light,White light illuminated stationary before rapidly heading North and disappearing,02/25/2024,Y,
Open,02/24/2024 3:05,Kamiah,ID,USA,Changing,This has main lights with red and blue flashing that seems to rotate,02/24/2024,,
Open !,02/19/2024 21:15,Hilliard,FL,USA,Light,"While operating an aircraft in cruise at FL400, the crew observed 3 lights appearing and disappearing for approximately 1 hr 25 min.",02/20/2024,,
Open,02/18/2024 3:15,Manawa,WI,USA,Orb,1 to 3 fairly bright orbs (varied) maneuvering and loitering in ways uncharacteristic of typ. aircraft. No reference to judge distance.,02/18/2024,,
Open !,02/17/2024 20:43,Rockford,IL,USA,Light,Triangle formation of lights with other lights making passes through and around the formation,02/17/2024,Y,
Open !,02/16/2024 21:15,Pittsburgh,PA,USA,Light,8 Lights Moving in counter clockwise pattern with other lights making passes through and below the formation,02/16/2024,Y,
Open !,02/16/2024 19:04,Fayetteville,NC,USA,Triangle,Large acre plus-sized triangular craft traveling approx 32000 feet.,03/26/2024,Y,
Open,02/14/2024 12:30,Potomac Falls,VA,USA,Unknown,Two objects seen from ground flying against wind today.,02/14/2024,Y,
Open,02/11/2024 21:05,Monterey,CA,USA,Unknown,"An object similar to a satellite shot across the sky in about 3 seconds, and turned about 40 degrees",07/21/2024,Y,
Open,02/10/2024 21:31,Ozona,TX,USA,Other,The thing is I see these regularly and I have time loss I can't even remember these particular pictures.,02/14/2024,Y,
Open,02/06/2024 22:57,Lamar,CO,USA,Oval,We saw what looked like dogfighting spacecraft,04/25/2024,Y,Aircraft?
Open !,02/05/2024 22:32,Hoquiam,WA,USA,Light,Light moving erratically,02/06/2024,Y,
Open !,02/05/2024 4:55,Omaha,NE,USA,Light,"Flying to the East at 39,000 saw 6 UFO's at diff speeds, altitudes (btn 50, and 80 thousand feet) for ~ 1 hr",02/05/2024,Y,
Open,02/04/2024 18:47,Caledonia,MI,USA,Orb,Hovered in one general area for almost an hour; quickly changed directions and made figure 8 patterns,02/04/2024,,
Open !,01/14/2024 21:10,Ithaca,NY,USA,Light,"Two lights climbing, descending, and changing direction rapidly",01/14/2024,,
Open !,01/14/2024 5:00,Phoenix,AZ,USA,Formation,Maneuvering lights at very high altitude views for 45 minutes at FL400,01/19/2024,,
Open,01/11/2024 16:45,Parkersburg,WV,USA,Diamond,Subject was passenger in car when observed object in western sky out passenger side. Photo taken with phone through window.,01/17/2024,Y,Contrail
Open !,01/11/2024 4:30,,Erzincan,Türkiye,Sphere,Multiple lights flying and moving randomly.,01/20/2024,Y,
Open !,01/10/2024 20:10,Yakima,WA,USA,Light,"Flying from DEN to PSC at 34,000’. Witnessed moving lights moving very fast and would appear and disappear. ATC had nothing on radar.",01/10/2024,Y,
Open !,01/09/2024 21:00,Lindau,Lower Saxony,Germany,Chevron,Close Encounter with landed craft while jogging late through the countryside.,06/18/2024,Y,
Open !,01/07/2024 20:40,Roseburg,OR,USA,Light,2 lights looked to be spinning.,01/07/2024,,
Open,01/07/2024 18:12,Gun Barrel City,TX,USA,Light,Unusual fast moving glow on south-southwest horizon moving east. Appeared surrounded by a haze but clear night. Very fast mover.,01/07/2024,Y,Rocket
Open !,01/05/2024 21:10,Sault Ste. Marie,ON,Canada,Light,Erratically moving lights that would appear and disappear staying in the same approximate location in relation to the stars,01/05/2024,Y,
Open,12/29/2023 3:30,,,International Waters,Circle,Flying objects doing different elliptical orbits,12/29/2023,Y,
Open,12/28/2023 19:00,Tehachapi,CA,USA,Other,3 objects appearing shortly after shooting star event,12/29/2023,,Meteor?
Open !,12/26/2023 20:40,Bunnell,FL,USA,Changing,What appeared as bright star like points of light which would suddenly appear increasing in brightness and then fade away.,12/27/2023,Y,
Open !,12/23/2023 3:30,,,International Waters,Light,"Objects at very high altitude (greater than 50,000' MSL) maneuvering and emitting white light that gradually varied from bright to dim",01/04/2024,,
Open !,12/20/2023 3:00,Horace,KS,USA,Unknown,4 white lights of changing intensity resembling stars moving in a portion of the night sky.,12/20/2023,Y,
Open !,12/16/2023 22:45,Little Rock,AR,USA,Light,5 Lights Moving Rapidly and Changing Direction,01/14/2024,,
Open !,12/14/2023 19:45,Pawleys Island,SC,USA,Triangle,4-5 orange solid lights arranged in a triangle shape,12/14/2023,,
Open,12/14/2023 17:40,Fingerville,SC,USA,Light,"Light was observed, likely stationary then it just extinguished and disappeared",12/17/2023,Y,
Open,11/24/2023 14:00,Odell,IL,USA,Sphere,We saw a 10’ black ball off our right wing at 5500’.,11/26/2023,Y,
Open !,11/21/2023 20:30,Stillwater,OK,USA,Light,As many as 4 lights were simultaneously observed corroborated with no less than 6-7 other aircraft on Denver Center,11/21/2023,Y,
Open !,11/21/2023 19:00,Oklahoma City,OK,USA,Light,Points of light maneuvering in upper atmosphere,11/23/2023,Y,
Open !,11/13/2023 20:20,Cheyenne,WY,USA,Light,Saw a light go from dim to very bright,11/16/2023,,
Open,11/11/2023 23:59,Redding,CA,USA,Orb,Descending blue/white orb,11/16/2023,,
Open !,10/31/2023 19:00,Casa Grande,AZ,USA,Light,Rectangular light fixed in the Northwestern sky for over 3 hours.,10/31/2023,Y,
Open,10/31/2023 16:01,"Anchieta, Porto Alegre",Rio Grande do Sul,Brazil,Oval,I have being recording these objects over all airplanes near Salgado Filho Internacional AirPort. Footage reduced 8 times . iPhone XR,11/27/2023,Y,Aircraft?
Open !,10/23/2023 3:30,Airborne (Oman),,Oman,Light,Observed steady lights at high altitude at a specific location in the sky.,10/23/2023,Y,
Open,10/17/2023 21:40,Big Bend,TX,USA,Orb,Large orb / crescent light traveled from south to north for a few seconds then appeared to dissipate above our heads.,10/22/2023,,
Open !,10/17/2023 2:00,Middle of the Caspian Sea directly east of Baku,,Unspecified,Light,Two commercial airline pilots saw a light 150km away that was still then suddenly accelerated at incredible speed and disappeared,10/25/2023,,
Open,10/13/2023 19:36,Sandia,TX,USA,Light,Moving object with bright light which emitted a vapor ring that emanated in front of the moving object.,10/13/2023,,Reflection
Open !,10/05/2023 23:00,Chicago,IL,USA,Light,Lights maneuvering rapidly at extreme altitude,10/12/2023,,
Open !,10/03/2023 2:50,Boston,MA,USA,Circle,Airline pilot - Lights high in sky ahead and above coming in and out,10/06/2023,Y,
Open !,09/23/2023 5:30,Huntersville,NC,USA,Flash,3 individual bright flashes of light and a separate large orb of light.,09/28/2023,,
Open !,09/21/2023 2:30,We were airborne heading East at 39000 feet,NE,USA,Light,Up to 4 UFO outside earths atmosphere,09/21/2023,,
Open,09/16/2023 16:00,Bainbridge Island,WA,USA,Orb,"Walking my dog, I look up to see another of these Orbs of bright white light silently, gliding, low and slightly wobbly.",01/30/2024,Y,
Open !,09/16/2023 14:40,Alingsås,Västra Götaland County,Sweden,Orb,Near midair collision between tow plane and orb,09/16/2023,,
Open !,09/10/2023 18:49,Bass Lake,IN,USA,Rectangle,"Object flew past our aircraft at 10,000 feet within 200 yards of our right wing.",09/13/2023,,
Open !,09/07/2023 23:00,Knoxville,NC,USA,Light,I saw a small light that looked like a star appear dim then go bright.,09/28/2023,,
Open,09/07/2023 0:00,,CO,USA,Flash,"Orb started to dive down erratically, climb irately, and then move to the left",07/07/2024,,
Open !,09/04/2023 2:20,Estes Park,CO,USA,Disk,"Large, disc shaped, brightly lit, silent craft hovered approximately 100' above our car.",09/28/2023,,
Open,09/02/2023 11:00,Clayton,NC,USA,Oval,White motionless dot in a clear blue sky which disappeared and reappear two times in different locations in a linear path.,09/11/2023,,
Open !,08/30/2023 3:30,St. Louis,MO,USA,Light,3 to 4 lights rotating around each other,08/30/2023,Y,
Open,08/26/2023 21:40,San Antonio,TX,USA,Light,Bright slow moving light. Appeared to be a search light in the distance (helicopter) (drone) then disappeared after plume of smoke,08/27/2023,Y,Rocket
Open !,08/25/2023 0:00,,Islamabad Capital Territory,Pakistan,Formation,Several groups of lights moving in orbiting formation and erratically changing altitude impossibly fast,10/13/2023,Y,
Open,08/22/2023 21:10,Downe,NJ,USA,Light,"Saw what a first looked like a flashlight. When I approached, flash of light on the horizon. Unable to recall even for 8 months.",06/21/2024,Y,
Open,08/17/2023 20:17,Guntersiville,AL,USA,Other,"Object was bright white, flying horizontally moving faster than any aircraft I seen, (I was a Navy pilot)",08/17/2023,,
Open,08/11/2023 22:50,Crescent City,CA,USA,Other,"2 people witness consistent lights lighten up in the Big Dipper, travel a short distance then fade out.",02/29/2024,Y,
Open !,08/08/2023 2:00,Bizerte,Tunis Governorate,Tunisia,Light,Multiple lights (6 seen) fading on and off (10s) forming multiple formations moving in all directions (not orbital) in stratosphere,08/14/2023,,
Open !,08/06/2023 17:13,Madison,AL,USA,Rectangle,"40-50,000 ft heading 255-265 degrees for 4 minutes then sharp left turn to about 160 degrees",08/11/2023,,
Open !,07/30/2023 14:30,Millen,GA,USA,Sphere,Black sphere flying over Georgia,08/08/2023,,
Open,07/30/2023 1:30,Pembroke,NH,USA,Sphere,Driving home from Hospice House (Mom dying). Witnessed a sphere shaped craft. Changing colors and spinning very fast.,01/23/2024,Y,
Open !,07/28/2023 23:30,Douglasville,GA,International Waters,Circle,Airline Pilot sighting of UAP over international waters with photos and videos,08/03/2023,Y,
Open,07/21/2023 22:15,Los Angeles,CA,USA,Light,10 to 15 glowing lights changing color at high altitude.,07/28/2023,,Flares?
Open,07/06/2023 7:50,Pottstown,PA,USA,Circle,JBU555 pilots reported fast flying object 4-5 thousand feet above,07/06/2023,,
Open !,06/29/2023 13:30,,,Kyrgyzstan,Other,We were flying westbound FL320. I saw a contact approaching our right (North) side. TCAS showed nothing. Passed close slightly higher,07/10/2023,Y,
Open,06/20/2023 19:35,Los Angeles,CA,USA,Changing,"Two vets, a pilot saw a sphere, change to cigar, get big and small, not plane, not space station, moving slow at 60k+'",06/20/2023,Y,
Open,06/20/2023 16:20,Cedar Rapids,IA,USA,Orb,11 sphere balls all gray going against the wind in a v formation.,02/18/2024,,
Open,06/10/2023 15:17,Vass,NC,USA,Orb,"Silver Orb/Balloon Passing Aircraft around 5,000 feet MSL near Fort Liberty/Fort Bragg June 10th, 2023 3:17pm local",06/13/2023,Y,Balloon?
Open !,05/28/2023 23:00,Atlanta,GA,USA,Orb,Commercial flight crew observes burst of light during takeoff.,06/04/2023,Y,
Open,05/14/2023 11:57,Simnasho,OR,USA,Sphere,"Flying southbound, saw 2 silver spheres at 10,700'",06/02/2023,,
Open,05/07/2023 1:55,VALDOSTA,GA,USA,Orb,5 orbs moving vertically and horizontally and getting very bright than dim,05/06/2023,,
Open,05/05/2023 20:00,Payson,AZ,USA,Circle,Saw an extremely bright light moving incredibly fast east to west parallel to the horizon.,05/06/2023,,
Open !,04/19/2023 0:30,Texarkana,AR,USA,Circle,"The pilot of BYA584 at FL270 approximately 41 miles southwest of Texarkana, AR reported lights off to the north.",04/19/2023,,
Open !,04/15/2023 2:23,Cottage grove,OR,USA,Formation,Two unknown lights behaving strangely,04/15/2023,Y,
Open !,04/13/2023 0:30,Estimated around Grand Junction,CO,USA,Formation,"What seemed to be crafts with bright lights rotating in circle formations descending to earth, then ascending later on.",04/23/2023,,
Open,04/11/2023 19:40,,,International Waters,Light,"Light from the east moving at incredible speed, then comes to dead stop.",05/24/2023,,
Open !,04/07/2023 2:35,,CA,USA,Orb,"3 orbs of light, similar to stars or planets. They would glow bright and then fade. They were stationary and then would reposition.",04/07/2023,,
Open,04/04/2023 21:00,Sherrills Ford,NC,USA,Unknown,Waiting to watch the ISS fly by we spotted an object traveling west with two blinking green lights...it stopped hovered and flew off,04/04/2023,,
Open !,03/27/2023 23:15,"Boarder of Colorado, Utah and Wyoming",CO,USA,Light,"3 lights forming a triangle, converging, disappearing. Then reappearing forming a triangle, converging then disappearing again.",03/28/2023,,
Open !,03/10/2023 12:00,,,Unspecified,Orb,Extremely bright light that would fade in and out at high velocity in apparent sporadic tracks over the Pacific Ocean,03/15/2023,,
Open !,03/07/2023 3:40,Waco,TX,USA,Light,"One single slowly pulsing very bright light then multiple lights moving erratically (staying stationary, changing direction rapidly)",03/07/2023,Y,
Open !,03/05/2023 3:30,,-,USA,Formation,Four to five pulsating bright lights that would fade in and out and would move around each other.,03/05/2023,,
Open !,02/27/2023 19:54,Atlanta,GA,USA,Cylinder,UAP spotted over Atlanta from 37000 feet,03/08/2023,Y,
Open,02/19/2023 20:58,Waterford,MI,USA,Orb,"Bright white light orbs with green edges, very bright and rocketing very fast towards the ground west of PTK airport",02/19/2023,,
Open !,02/09/2023 3:45,Montgomery,AL,USA,Sphere,We saw at least 10 bright starlight looking objects that flew fast and in various directions. Multiple other pilots on guard saw them,02/09/2023,,
Open,01/09/2023 4:05,Joplin,MO,USA,Light,White light moving left and right slowly cycling bright to dim,01/09/2023,,
Open !,11/09/2022 20:15,"Arrival into Eugene, OR",OR,USA,Light,Sighting of one to two extremely bright maneuvering lights at extreme distance and elevation.,01/09/2023,,
Open !,10/11/2022 22:17,Denver,CO,USA,Orb,Multiple sightings of maneuvering orbs,04/10/2023,Y,
Open !,08/29/2022 22:36,Haubstadt,IN,USA,Rectangle,I am a airline pilot. We were at 38000 ft when encountered,11/13/2023,Y,
Open !,08/24/2022 15:30,Gallipolis,OH,USA,Egg,"It was gold in color, stationary over the runway, then it shot off like a bullet to the North.",04/22/2023,,
Open,08/15/2022 16:29,Lawndale,CA,USA,Circle,"While trying to analyze my golf swing, I caught the subject accidentally",08/02/2024,Y,
Open,07/10/2022 15:33,Festus,MO,USA,Unknown,Skydiver/pilot witness craft passing by during climb up.,02/14/2024,Y,
Open,05/30/2022 10:35,Woodinville,WA,USA,Formation,4 objects flying in formation captured on video in the night sky over Western Washington,01/11/2024,,
